{
  "id": "01jrcasebox0000000000000c4",
  "tenant_id": "tenant-local-v1",
  "actor_user_id": "local-user",
  "matter_id": "01jrcasebox0000000000000m1",
  "target_type": "document",
  "target_id": "01jrcasebox0000000000000d1",
  "level": "normal",
  "prior_level": "confidential",
  "change_reason_code": "client_authorization",
  "change_reason_text": null,
  "set_at": "2026-05-20T15:15:00.000Z"
}
